guid,text,extra,tags
HJ>A]/})oZ,"As a process executes, it changes {{c1::state}}",,"CS::OSChapter03, CS::operating-systems"
sBYtqX7wtD,"{{c1::Parent}} processes create {{c2::children}} processes, which in turn create other processes, forming a {{c3::tree}} of processes",,"CS::OSChapter03, CS::operating-systems"
r:dI0(eY|D,"The {{c1::CPU scheduler}} selects from among the processes in ready queue, and allocates a CPU core to one of them",,"CS::OSChapter05, CS::operating-systems"
tcd!`y@}qH,Preemptive scheduling algorithms can result in {{c1::race}} conditions.,,"CS::OSChapter05, CS::operating-systems"
,"Deadlock can arise if four conditions hold simultaneously.<br/>{{c1::<b>Mutual Exclusion</b>}}: only one process at a time can use a resource.<br/>{{c2::<b>Hold and wait</b>}}: a process holding at least one resource is waiting to acquire additional resources held by other processes <br/> {{c3::<b>No preemption</b>}}: a resource can be released only voluntarily by the process holdign it, after that process has completed its task<br/>{{c4::<b>Circular wait</b>}}: There exists a set {P0, P1, … Pn} of waiting processes such that P0 is waiting for a resource that is held by P1, P1 is waiting for a resource that is held by P2, .., Pn-1 is waiting for a resource that is held by Pn and Pn is waiting for a resource that is held by P0",,"CS::OSChapter08, CS::operating-systems"
,A program must be brought from {{c1::disk}} into  {{c2::memory}} and placed within a {{c3::process}} for it to be run,,"CS::OSChapter09, CS::operating-systems"
